date,plant_name,botanical_name,image_url,fact_1,fact_2,fact_3,use_1,use_2,use_3,region,habitat,category,history,description
10,Papaya,Carica papaya,https://images.pexels.com/photos/7839741/pexels-photo-7839741.jpeg,"Did you know Papaya leaves can treat dengue fever by boosting platelet counts, per traditional medicine?","Did you know Papaya plants can grow from seed to fruit in just 9 months, a rapid cycle?",Did you know Papaya latex is used in chewing gum production for its natural elasticity?,"Digestive aids: Papaya leaves contain papain, an enzyme used in supplements for digestive health.","Meat tenderizer: Papaya leaf enzymes break down proteins, tenderizing meat in culinary applications.","Fruit production: Papaya plants yield vitamin-rich fruits, supporting tropical agriculture and diets.",Fruit production,Tropical Americas,Tropical,Herb,"Papaya (Carica papaya) is a fast-growing tropical plant native to the Americas, notable for being a giant herb rather than a true tree. Typically reaching 10 to 30 feet in height, papaya features an unbranched, hollow trunk topped with a crown of large, deeply lobed leaves. These leaves, arranged in a spiral, are designed for efficient photosynthesis in warm, humid climates. Flexible yet fragile, they fall off regularly, making way for continuous new growth.

The leaves and latex of papaya contain enzymes such as papain and chymopapain, which aid digestion and are widely used in meat tenderizers, dietary supplements, and traditional medicine. Papaya leaves are also brewed into teas to support digestive health and have been used in folk remedies against malaria and infections. Despite having shallow roots that make the plant vulnerable to wind damage, papaya compensates with rapid growth and early fruiting, often producing harvests within the first year.

Papaya fruits are globally cherished for their sweet, juicy flavor and high nutritional value. Rich in vitamins A and C, folate, and antioxidants, they support immunity and overall wellness. The orange flesh is eaten fresh, blended into smoothies, or processed into jams and desserts, while the black seeds are used in traditional medicine for their antiparasitic properties.

Culturally, papaya has deep roots in pre-Columbian civilizations, where it was cultivated as both food and medicine. Its significance later spread to Asia, Africa, and the Caribbean through colonial trade, where it quickly became a staple crop. Today, papaya plays a vital role in tropical agriculture, supporting food security, smallholder economies, and sustainable farming systems.

With its adaptability, rapid regeneration, and wide-ranging uses, papaya remains an iconic plant of the tropics, blending nutritional, medicinal, and cultural importance worldwide."
11,Jamun,Syzygium cumini,https://sarvodayainstitute.org/cdn/shop/files/IMG_4542.heic?v=1682995877&width=1946,"Did you know Jamun fruits can dye fabrics purple, used traditionally in South Asian textiles?","Did you know Jamun trees can survive floods due to their deep, resilient root systems?",Did you know Jamun seeds are ground into powder to manage blood sugar in herbal remedies?,Oral health: Jamun fruit’s astringent properties promote gum health and combat oral bacteria effectively.,"Fruit production: Jamun trees produce dark purple fruits, a staple in South Asian diets.",Shade provider: Jamun’s dense canopy offers cooling shade in tropical urban and rural areas.,South Asia,Tropical,Tree,Valued in Ayurvedic medicine,"Jamun (Syzygium cumini) is a large evergreen tree native to South Asia, thriving in tropical and subtropical climates. Reaching heights of 50 to 100 feet, jamun is distinguished by its straight trunk, dense branching, and glossy, leathery leaves that taper to a pointed tip. These leaves are well adapted to conserve moisture, enabling the tree to withstand prolonged dry seasons. Its thick canopy provides ample shade, making jamun a favored tree for urban landscapes, village courtyards, and roadside plantings.

The most celebrated feature of jamun is its fruit—a small, oval, deep purple to black drupe with a sweet yet astringent flavor. Rich in vitamin C, iron, and antioxidants, the fruit is cherished both as food and medicine. In Ayurveda, jamun is highly regarded for regulating blood sugar levels, supporting digestion, and promoting oral health. The leaves and bark have antimicrobial properties, while the seeds are used in powdered form to manage diabetes and gastrointestinal disorders. Chewing jamun leaves is a traditional practice for strengthening gums and reducing oral bacteria.

Ecologically, jamun plays an important role in supporting biodiversity. Its flowers attract pollinators like bees, and the fruits are relished by birds, bats, and small mammals, aiding seed dispersal. The tree thrives in a wide range of soils, from sandy loam to clay, and tolerates heat and drought, making it a resilient species for reforestation and sustainable agriculture.

Culturally, jamun has been cultivated in India for thousands of years, often celebrated in folklore, festivals, and diets. Its fruit is consumed fresh, salted, or processed into juices, wines, and preserves. The durable wood, though not used for large-scale timber, is valued for making furniture, tools, and agricultural implements.

With its nutritional, medicinal, cultural, and ecological importance, jamun stands as a cornerstone tree of tropical landscapes."
12,Ashoka,Saraca asoca,https://wildroots.in/wp-content/uploads/2021/01/d7a2a86077e7c6f06d932f6409e3d1e5.jpg,"Did you know Ashoka trees can reduce noise pollution with their dense foliage, ideal for urban areas?","Did you know Ashoka flowers are used in perfumes for their sweet, lingering fragrance?",Did you know Ashoka bark is used in traditional medicine to treat menstrual disorders?,Ornamental landscaping: Ashoka’s orange flowers and lush foliage enhance tropical gardens and parks.,Shade provider: Ashoka’s compact canopy provides modest shade for small urban and rural spaces.,Medicinal uses: Ashoka bark treats reproductive health issues in traditional Ayurvedic medicine.,South Asia,Tropical,Tree,Sacred in Indian culture,"Ashoka (Saraca asoca) is a compact, evergreen tree native to South Asia, admired for its beauty, cultural symbolism, and medicinal properties. Growing to a modest height of 20 to 30 feet, it thrives in tropical and subtropical climates, especially in well-drained soils with partial shade. Its narrow, elongated, and leathery leaves appear in symmetrical pairs, providing resilience against drought and heat. The dense foliage creates a graceful canopy, offering modest shade, while its striking clusters of bright orange to scarlet flowers make it one of the most ornamental species in South Asia.

Medicinally, Ashoka holds immense value in Ayurveda. The bark and leaves are widely used in formulations addressing reproductive health, menstrual disorders, and pain relief. Known for its cooling, healing, and anti-inflammatory properties, Ashoka has been part of traditional remedies for centuries. Its extracts are also employed to treat skin ailments and digestive imbalances, making it a cornerstone of holistic medicine.

Culturally, the Ashoka tree is deeply revered. In Indian traditions, it symbolizes love, fertility, and protection, often mentioned in ancient literature, poetry, and religious texts. Historically, it was planted in royal gardens, temple courtyards, and near sacred spaces, not only for its beauty but also for its association with auspiciousness and spiritual well-being.

Ecologically, Ashoka plays an important role in supporting biodiversity. Its bright flowers attract bees, butterflies, and other pollinators, while its evergreen nature ensures greenery year-round. The tree’s ability to adapt to varying conditions and require minimal care makes it a sustainable choice for urban landscaping, roadside planting, and ornamental gardens.

Today, Ashoka is cultivated widely across tropical regions of the world, appreciated for its aesthetic elegance, cultural significance, and medicinal benefits. With its enduring legacy, it continues to bridge the natural, spiritual, and human worlds."
13,Gulmohar,Delonix regia,https://images.pexels.com/photos/2264075/pexels-photo-2264075.jpeg,"Did you know Gulmohar trees can signal seasonal changes, blooming vividly before monsoons?",Did you know Gulmohar seeds are used as beads in traditional jewelry in tropical regions?,"Did you know Gulmohar wood is lightweight, making it ideal for crafting small boats?",Ornamental planting: Gulmohar’s vibrant red flowers beautify urban landscapes and tropical gardens.,Shade provider: Gulmohar’s canopy offers cooling shade for streets and public spaces.,Street tree: Gulmohar’s heat tolerance makes it ideal for lining tropical urban roads.,Africa,Tropical,Tree,Introduced widely in tropics,"Gulmohar (Delonix regia), often called the “Flame of the Forest,” is a deciduous tree native to Madagascar, celebrated for its dazzling floral display and graceful foliage. Growing between 30 and 40 feet, Gulmohar has a broad, spreading crown that provides generous shade, making it highly valued in tropical and subtropical cities. Its delicate, feathery leaves are composed of tiny paired leaflets that close during rain or at night, an adaptation that conserves energy and reduces water loss in warm climates.

The tree’s most striking feature is its clusters of bright red to orange-red flowers, which bloom profusely during the summer months. These blossoms attract bees, butterflies, and other pollinators, supporting local ecosystems and enhancing urban biodiversity. In addition to its ecological role, Gulmohar is widely admired as an ornamental species, transforming streets, parks, and gardens into vibrant, colorful landscapes. Its resilience in high heat and tolerance of well-drained soils make it especially suitable for regions with dry or semi-arid conditions.

Beyond its visual appeal, Gulmohar also has practical uses. The wood, though not particularly strong, is utilized for small crafts, tools, and fuel. Its expansive canopy creates a natural cooling effect, reducing urban heat and providing shade in densely populated areas. Introduced around the world through colonial trade, the tree has become naturalized across Asia, the Caribbean, and the Americas, where it is often associated with beauty, celebration, and resilience.

Culturally, Gulmohar holds symbolic value in many tropical societies. In India and Southeast Asia, it is a favorite for roadside planting and schoolyards, embodying the spirit of summer. Its sensitivity to seasonal changes, light, and moisture makes it a dynamic and ever-changing presence in landscapes. As both a practical and aesthetic species, Gulmohar contributes to sustainable urban greening and remains one of the most beloved flowering trees worldwide."
14,Bamboo,Bambusa vulgaris,https://images.pexels.com/photos/881235/pexels-photo-881235.jpeg,"Did you know Bamboo can grow up to 3 feet in a single day, one of the fastest-growing plants?","Did you know Bamboo charcoal is used to purify water, removing toxins naturally?",Did you know Bamboo leaves are woven into mats for traditional Asian roofing?,Construction material: Bamboo’s strong stalks are used in eco-friendly furniture and building structures.,Soil erosion control: Bamboo’s rapid growth and roots stabilize soil in flood-prone areas.,Panda food: Bamboo leaves and shoots are a primary food source for pandas.,Southeast Asia,Tropical to Temperate,Grass,Used in Asian architecture,"Bamboo (Bambusa vulgaris) is not a tree but a giant grass, renowned worldwide for its rapid growth, resilience, and ecological importance. Native to Southeast Asia, it thrives in tropical and subtropical climates, though many species adapt to temperate zones. Bamboo can reach impressive heights of 30 to 100 feet, with tall, segmented culms that grow in dense clusters. Its long, narrow, pointed leaves are rich in silica, which strengthens the plant’s structure and makes it resistant to pests and environmental stress.

One of bamboo’s most remarkable qualities is its growth rate—certain species can grow over three feet in a single day. This rapid regeneration makes bamboo an excellent choice for reforestation, soil stabilization, and erosion control, especially in regions affected by deforestation. Its strong, lightweight stalks have been used in construction for centuries, particularly in Asia, where bamboo forms the backbone of eco-friendly housing, scaffolding, bridges, and even musical instruments. Modern sustainable architecture continues to embrace bamboo as a renewable alternative to timber and steel.

Beyond construction, bamboo plays a vital role in ecosystems. Its dense foliage offers shelter to birds and insects, while the leaves serve as a crucial food source for animals, most famously the giant panda. Bamboo groves also absorb significant amounts of carbon dioxide, contributing to climate change mitigation.

Culturally, bamboo carries deep symbolic meaning in Asian traditions, representing resilience, flexibility, and harmony with nature. It has been used in medicine, cuisine, paper-making, and art for thousands of years. Today, bamboo’s global cultivation underscores its versatility, with applications ranging from textiles to biodegradable packaging.

As both a practical material and an ecological resource, bamboo exemplifies sustainability, supporting human needs while protecting natural environments. Its ability to regenerate quickly without depleting soil nutrients makes it one of the most valuable renewable resources worldwide."
15,Rose,Rosa indica,https://images.pexels.com/photos/4449425/pexels-photo-4449425.jpeg,"Did you know Rose petals can be distilled into rose water, used in Middle Eastern desserts?","Did you know Rose plants can live for decades, with some varieties over 100 years old?","Did you know Rose thorns protect against herbivores, aiding survival in diverse climates?",Ornamental gardening: Roses’ colorful blooms make them a staple in global garden landscapes.,Perfume ingredient: Rose petals are distilled into fragrant oils for high-end perfumes.,Floral decoration: Rose flowers enhance events and spaces with their aesthetic appeal.,Global,Temperate to Subtropical,Shrub,Symbol of love historically,"Rose (Rosa indica) is one of the most cherished perennial shrubs in the world, admired for its beauty, fragrance, and symbolism across cultures. Native to Asia but cultivated globally for centuries, roses typically grow between 3 and 6 feet tall, though some varieties form compact bushes while others climb as tall vines. The plant features pinnate, serrated leaves that are dark green, leathery, and efficient in conserving water, helping the shrub adapt to a wide range of climates.

Roses thrive in full sunlight and well-drained, fertile soils, responding well to regular pruning and care. Their blossoms appear in countless colors—red, pink, white, yellow, orange, and even multicolored hybrids—each carrying unique cultural meanings. Beyond their ornamental appeal, rose petals are valued for their fragrance and are distilled into perfumes, rose water, and essential oils used in cosmetics and cuisine. The flowers are also edible and often incorporated into teas, syrups, and desserts.

Culturally, roses symbolize love, passion, purity, and devotion, making them central to traditions, poetry, and rituals worldwide. Historically, roses were cultivated in ancient Persia, India, and Rome, where they adorned gardens, temples, and ceremonial spaces. During the Middle Ages, roses became emblematic in European heraldry, particularly in the Wars of the Roses between the Houses of York and Lancaster.

Ecologically, roses attract pollinators such as bees and butterflies, strengthening biodiversity in gardens and agricultural landscapes. Modern horticulture has produced thousands of varieties, bred not only for their vibrant beauty but also for climate adaptability and resistance to common pests and diseases.

Today, roses remain a cornerstone of global floriculture, with immense economic value in the cut-flower industry, landscaping, and essential oil production. Their enduring charm, cultural richness, and ecological role make roses more than ornamental plants—they are living symbols of human history and natural beauty."
16,Tamarind,Tamarindus indica,https://images.pexels.com/photos/15095868/pexels-photo-15095868.jpeg,"Did you know Tamarind pulp can preserve fish, used traditionally in coastal cuisines?",Did you know Tamarind trees can withstand hurricanes due to their flexible branches?,Did you know Tamarind seeds are crafted into beads for jewelry in African cultures?,Culinary ingredient: Tamarind fruit pulp adds tangy flavor to global dishes and sauces.,Herbal teas: Tamarind leaves are brewed into teas for digestive and health benefits.,Shade provider: Tamarind’s wide canopy provides cooling shade in tropical environments.,Africa,Tropical,Tree,Used in global cuisines,"Tamarind (Tamarindus indica) is a long-lived tropical tree native to Africa, though it has been widely naturalized across South Asia, Southeast Asia, and Latin America. It is an evergreen to semi-evergreen species that can grow between 60 and 80 feet tall, forming a broad canopy that provides dense shade. Its compound leaves consist of numerous small, rounded leaflets that fold inward at night or during intense sunlight, demonstrating a natural adaptation to conserve energy and moisture.

The tree thrives in hot, arid to semi-humid climates and tolerates drought once established. Tamarind produces pod-like fruits with a sticky, brown pulp that is both tangy and sweet, making it a prized ingredient in cuisines worldwide. In South Asian cooking, tamarind pulp is essential for chutneys, curries, and beverages, while in Latin America it flavors candies, sauces, and refreshing drinks. The young leaves are also edible when cooked and are used in soups and stews, while herbal teas made from the foliage are traditionally consumed for their digestive and cooling benefits.

Beyond culinary uses, tamarind has ecological and practical value. Its deep root system anchors soil, helping to prevent erosion, and its canopy supports biodiversity by providing shelter for birds and pollinators. The dense, durable wood of tamarind is used in small-scale construction, furniture, and tool handles.

Historically, tamarind spread across continents through ancient trade routes, becoming integrated into diverse food cultures and traditional medicine practices. In Ayurveda and other systems, it is valued for aiding digestion, reducing fever, and providing antioxidants. Today, tamarind continues to play a central role in global agriculture, cuisine, and ecological sustainability. Its versatility as a food source, medicinal plant, and shade provider highlights its enduring importance in tropical and subtropical landscapes."
17,Moringa,Moringa oleifera,https://images.squarespace-cdn.com/content/v1/5d551402a75c9d00010c7df1/4cdbbcd9-1d21-4615-9c15-615f5ff58db9/Three_year_old_Moringa_Oleifera_tree.jpg,"Did you know Moringa leaves can purify water by removing bacteria, used in rural communities?","Did you know Moringa seeds can produce oil for cooking, a sustainable alternative?","Did you know Moringa trees can grow in saline soils, aiding agriculture in harsh regions?","Nutritional supplements: Moringa leaves, rich in iron, are used in health supplements.",Medicinal uses: Moringa’s antioxidant leaves treat various ailments in traditional medicine.,Food source: Moringa leaves and pods provide nutrition in food-scarce tropical regions.,South Asia,Tropical,Tree,Used in food aid programs,"Moringa (Moringa oleifera) is a fast-growing, drought-tolerant tree native to South Asia, particularly the foothills of the Himalayas, though today it is cultivated widely across Africa, the Middle East, and tropical regions of the Americas. Commonly called the “drumstick tree” or “miracle tree,” it typically grows 30–40 feet tall with slender branches and compound leaves bearing numerous tiny, rounded leaflets that form lush green clusters. These leaves fold slightly during intense sunlight, minimizing water loss, an adaptation suited to arid climates.

Moringa is globally celebrated for its remarkable nutritional profile. The leaves are exceptionally rich in vitamins A, C, and E, as well as minerals such as calcium, iron, magnesium, and potassium. They are consumed fresh, dried into powders, or incorporated into teas, soups, and supplements, making moringa an essential ingredient in food security and aid programs worldwide. In many regions, moringa leaves and pods are used to combat malnutrition, particularly in children and nursing mothers.

Beyond nutrition, moringa has a long history in traditional medicine. Its leaves, flowers, seeds, and roots have been used for centuries to treat ailments ranging from inflammation and digestive issues to high blood pressure and fatigue. Rich in antioxidants and bioactive compounds, moringa is believed to support immune health, reduce oxidative stress, and promote overall vitality.

Ecologically, moringa thrives in poor soils with minimal water, making it valuable for sustainable agriculture and reforestation. Its deep roots stabilize soil, preventing erosion, while its flowers attract pollinators, enriching biodiversity. Farmers often interplant moringa with crops due to its ability to improve soil fertility and provide shade.

Historically cultivated in India and Africa for thousands of years, moringa’s global spread reflects both its resilience and value. Today, it is recognized worldwide as a powerful resource for nutrition, medicine, and sustainable farming."
18,Aloe Vera,Aloe barbadensis,https://images.pexels.com/photos/30872552/pexels-photo-30872552.jpeg,Did you know Aloe Vera gel can preserve food when applied as a natural coating?,"Did you know Aloe Vera plants can survive years without rain, storing water efficiently?",Did you know Aloe Vera was called the 'plant of immortality' in ancient Egypt?,"Skincare products: Aloe vera gel soothes skin, used in cosmetics and burn treatments.",Medicinal gel: Aloe vera’s gel aids wound healing and reduces inflammation effectively.,Ornamental planting: Aloe vera’s succulent leaves enhance arid gardens and indoor spaces.,Africa,Arid,Succulent,Used in ancient Egyptian medicine,"Aloe Vera (Aloe barbadensis) is a perennial succulent plant native to the arid regions of Africa, though today it is cultivated worldwide for its medicinal, cosmetic, and ecological benefits. Characterized by its thick, fleshy, lance-shaped leaves with serrated edges, aloe grows in a rosette pattern and typically reaches 1–2 feet in height. Its leaves act as reservoirs, storing large amounts of water, which allows the plant to survive prolonged droughts and thrive in sandy, well-drained soils. Inside the leaves lies a clear, mucilaginous gel, renowned for its soothing and healing properties.

For centuries, aloe vera has been recognized as a “plant of immortality.” Ancient Egyptian texts describe its use in embalming, skincare, and traditional medicine. The gel is still widely applied today to treat minor burns, cuts, and skin irritations, while its extracts are incorporated into countless skincare, cosmetic, and pharmaceutical products. Beyond topical use, aloe latex, found beneath the leaf skin, has been used historically as a natural laxative, though modern consumption requires caution.

Nutritionally, aloe contains vitamins A, C, E, and B12, along with minerals such as calcium, magnesium, and zinc, which contribute to its role in wellness supplements. Studies also suggest aloe gel may have antimicrobial, anti-inflammatory, and antioxidant properties, supporting its reputation as a versatile natural remedy.

Ecologically, aloe vera is valued for its resilience and minimal water needs, making it an ideal choice for xeriscaping and sustainable landscaping in arid and semi-arid climates. Its ease of propagation through offsets, often called “pups,” ensures rapid spread, while its evergreen nature provides greenery even in harsh conditions.

Globally cultivated across Africa, Asia, the Americas, and Mediterranean regions, aloe vera remains a cornerstone of natural health care, eco-friendly gardening, and sustainable agriculture, embodying both cultural heritage and modern scientific relevance."
