date,plant_name,botanical_name,image_url,fact_1,fact_2,fact_3,use_1,use_2,use_3,region,habitat,category,history,description
19,Coconut,Cocos nucifera,https://images.pexels.com/photos/3560367/pexels-photo-3560367.jpeg,"Did you know Coconut fronds are used to make brooms, a sustainable household tool?","Did you know Coconut trees can produce up to 75 fruits annually, supporting coastal diets?","Did you know Coconut water is sterile, used as an IV fluid in emergencies?",Thatch roofing: Coconut fronds are woven into durable roofing for tropical homes.,"Basket weaving: Coconut leaves are crafted into baskets, supporting traditional coastal crafts.","Shade provider: Coconut palms offer shade, enhancing tropical coastal landscapes and ecosystems.",Tropical Pacific,Tropical,Tree,Staple in coastal cultures,"Coconut (Cocos nucifera) is a tropical palm tree native to the Indo-Pacific region, now widely cultivated across coastal tropics worldwide. Reaching heights of 50–100 feet, it is characterized by a slender, ringed trunk topped with a crown of long, arching fronds. Each frond can exceed 12 feet in length, with narrow, pointed leaflets that sway gracefully in coastal winds. These leaves have been traditionally used for basket weaving, mat making, and thatch roofing, underscoring the tree’s importance in both cultural and practical contexts.

The coconut fruit, often called the “tree of life,” provides an array of resources. Its outer husk yields coir fibers for ropes and mats, while the hard shell is crafted into utensils and decorative items. Inside, the nutritious water and white flesh serve as food staples, while the extracted oil is used in cooking, cosmetics, and traditional medicine. Coconut milk and cream form essential ingredients in many tropical cuisines, reflecting the plant’s deep cultural integration.

Ecologically, the coconut palm plays a vital role in stabilizing sandy shorelines with its deep, fibrous root system that prevents erosion. Its canopy offers shade and habitat for birds, insects, and small animals, supporting biodiversity in fragile coastal ecosystems. Adapted to saline soils and thriving in high humidity, the tree grows prolifically along tropical coasts where other crops often fail.

Historically, coconuts spread naturally across oceans via buoyant fruits capable of germinating after long sea voyages. Human trade and migration further expanded their distribution, embedding coconuts into rituals, economies, and cuisines worldwide. Today, the coconut industry supports millions of livelihoods through agriculture, handicrafts, and exports, while also contributing to sustainable development.

Resilient, versatile, and culturally iconic, the coconut palm continues to serve as a cornerstone of tropical life, uniting ecological, economic, and traditional value."
20,Betel,Piper betle,https://images.pexels.com/photos/12164652/pexels-photo-12164652.jpeg,"Did you know Betel leaves can improve digestion when chewed, a traditional Asian practice?","Did you know Betel vines can climb over 20 feet, thriving in shaded tropics?",Did you know Betel leaf extracts are used in natural deodorants for their aroma?,Chewing stimulant: Betel leaves are chewed for their mild stimulant effects in Asian traditions.,Medicinal uses: Betel leaf extracts aid digestion and treat infections in traditional remedies.,Ornamental vine: Betel’s glossy leaves enhance tropical gardens as a climbing vine.,Southeast Asia,Tropical,Vine,Used in rituals for centuries,"Betel (Piper betle) is a perennial, fast-growing vine native to Southeast Asia, renowned for its glossy, heart-shaped leaves and distinctive spicy aroma. Belonging to the pepper family, this climber thrives in warm, humid, and shaded environments, often cultivated under partial canopy cover to protect its delicate leaves from direct sunlight. The vine can grow several meters in length, requiring support structures such as trellises, bamboo poles, or trees to climb. Its lush, green foliage not only serves functional uses but also adds ornamental value to tropical gardens.

Culturally, betel leaves have been central to traditions across Asia for centuries. The leaves are commonly chewed with areca nut and lime in a practice known as “paan,” which acts as a mild stimulant and has deep social and ceremonial importance. Offering betel leaves is a symbol of respect and hospitality in many South and Southeast Asian communities, while also being used in religious rituals, marriages, and cultural festivities. Beyond its symbolic role, betel leaves possess medicinal properties, being rich in antioxidants and essential oils. In traditional medicine, they are used to aid digestion, relieve respiratory issues, and act as a natural antiseptic.

Economically, betel cultivation supports countless small-scale farmers in tropical regions. The crop is labor-intensive, requiring careful watering, pruning, and harvesting to maintain leaf quality. Its high demand ensures steady market value, contributing significantly to rural livelihoods and local economies. Environmentally, betel vines help conserve soil moisture by providing ground cover and thrive in sustainable, mixed-farming systems where they coexist with other tropical crops.

Historically, betel has been cultivated and traded for thousands of years, spreading across Asia through cultural exchange and commerce. Today, it remains deeply woven into the traditions, health practices, and economies of tropical regions, symbolizing both cultural heritage and agricultural resilience."
21,Basil,Ocimum basilicum,https://www.bhg.com/thmb/jgWzadl7LxZofRylkWz4_47p18E=/1244x0/filters:no_upscale():strip_icc()/mrs-burns-lemon-basil-31966d9a-e03cd09ab70e40ba84bec0d2c628e341.jpg,"Did you know Basil can deter flies, making it a natural kitchen pest control?","Did you know Basil plants can produce seeds that form a gel, used in Asian desserts?",Did you know Basil was used in ancient Rome to symbolize love and fertility?,"Culinary herb: Basil’s aromatic leaves flavor Italian and Asian dishes, enhancing global cuisines.","Pest control: Basil’s scent repels flies and insects, protecting kitchen and garden spaces.",Ornamental gardening: Basil’s lush foliage adds aesthetic value to home and urban gardens.,Mediterranean,Temperate to Subtropical,Herb,Used in Italian cuisine,"Basil (Ocimum basilicum) is a tender, soft-stemmed herb native to the Mediterranean region, cherished for its aromatic leaves and versatile uses. Typically growing 1–2 feet tall, basil develops bright green, oval-shaped leaves that release a strong fragrance when touched. The plant thrives in full sun, warm temperatures, and well-drained but moist soils, making it an ideal choice for kitchen gardens and container planting. With proper care, basil can be harvested multiple times in a single growing season, as its rapid growth encourages continual leaf production.

Globally, basil is cultivated in more than 60 distinct varieties, each offering unique flavors and appearances, ranging from sweet basil with its mild, clove-like taste to Thai basil, known for its anise notes, and purple basil, valued for ornamental beauty. Its leaves are a cornerstone of cuisines worldwide, particularly Italian, Mediterranean, and Southeast Asian dishes, where they are used fresh in salads, sauces, and curries or dried as a seasoning. The plant not only enhances flavor but also contributes nutritional benefits, providing essential vitamins and antioxidants.

Historically, basil has been celebrated for both culinary and medicinal properties. Ancient cultures used it in traditional remedies for digestion, inflammation, and respiratory ailments. Symbolically, basil has carried spiritual meanings across societies, ranging from sacredness in India to a symbol of love and protection in Europe.

Environmentally, basil plays a supportive role in sustainable gardening. Its strong aroma attracts pollinators like bees and beneficial insects while repelling common pests, making it a natural companion plant for vegetables such as tomatoes and peppers. Its adaptability ensures cultivation in small home gardens as well as large-scale farms, contributing to food security and biodiversity.

Today, basil remains one of the world’s most popular herbs, valued equally for its flavor, fragrance, health benefits, and ecological contributions."
22,Coriander,Coriandrum sativum,https://images.pexels.com/photos/6633111/pexels-photo-6633111.jpeg,Did you know Coriander leaves can reduce heavy metal toxicity in the body?,"Did you know Coriander seeds were found in Tutankhamun’s tomb, showing ancient use?","Did you know Coriander plants can attract hoverflies, aiding garden pest control?","Culinary garnish: Coriander leaves, as cilantro, enhance global dishes with fresh flavor.",Medicinal uses: Coriander leaves and seeds detoxify and treat digestive issues traditionally.,Spice production: Coriander seeds are ground into a versatile spice for global cuisines.,Mediterranean,Temperate,Herb,Used in ancient cuisines,"Coriander (Coriandrum sativum) is a fast-growing, aromatic herb native to the Mediterranean and Western Asia, valued for both its leaves and seeds. Typically reaching 1–2 feet in height, coriander develops slender, upright stems with delicate, lacy green leaves, which are widely known as cilantro in many regions. The plant thrives best in cool, temperate climates with well-drained, fertile soil, although it is prone to bolting in hot weather. Its small, white to pale pink flower clusters attract pollinators and eventually produce round seeds, which are equally important in global cuisines.

Coriander is unique in offering two distinct flavors from a single plant. The fresh leaves are citrusy and bright, commonly used in garnishes, salads, chutneys, and salsas, while the dried seeds have a warm, nutty, and slightly spicy flavor, forming a staple spice in curries, pickles, and spice blends such as garam masala. This dual-purpose nature has made coriander indispensable in culinary traditions across Asia, the Middle East, Latin America, and Europe.

Historically, coriander holds one of the oldest records of culinary and medicinal use. Archaeological evidence shows its presence in ancient Egyptian tombs, where it was considered both a food and a medicinal herb. The Romans and Greeks also valued it for seasoning bread, wine, and preserving meat. In traditional medicine, coriander has been used to aid digestion, reduce inflammation, and promote overall wellness.

From an ecological perspective, coriander is well-suited for sustainable farming practices. It matures quickly, often ready for harvest within weeks, and enriches garden ecosystems by attracting bees, butterflies, and beneficial insects. As an easily cultivated crop requiring minimal resources, it supports small-scale farming, home gardening, and large agricultural systems alike.

Today, coriander continues to enrich global diets, linking ancient traditions with modern kitchens while contributing to biodiversity and sustainable food systems."
23,Mint,Mentha spicata,https://images.pexels.com/photos/32756463/pexels-photo-32756463.jpeg,"Did you know Mint can grow underwater, thriving in flooded conditions?",Did you know Mint leaves were used in ancient Greece to scent bathwater?,"Did you know Mint oil is used in toothpaste for its cooling, fresh flavor?","Culinary flavoring: Mint leaves add refreshing flavor to dishes, teas, and desserts worldwide.","Pest repellent: Mint’s aroma deters pests, protecting gardens and kitchens naturally.",Herbal teas: Mint leaves are brewed into soothing teas for digestion and relaxation.,Global,Temperate to Subtropical,Herb,Used in ancient remedies,"Mint (Mentha spicata) is a hardy, perennial herb celebrated for its refreshing aroma and diverse applications in culinary, medicinal, and ecological practices. Belonging to the Lamiaceae family, it is native to temperate regions across Europe, Asia, and Africa, though it has naturalized globally due to its resilience and adaptability. Growing to heights of 1–3 feet, mint develops square stems characteristic of the mint family, spear-shaped bright green leaves with serrated edges, and small clusters of lavender to pink flowers that attract pollinators.

Mint thrives in moist, well-drained soils and flourishes in partial shade, though it tolerates full sun with adequate water. Its vigorous growth habit, fueled by creeping rhizomes, allows it to spread rapidly, making it essential to grow in containers or confined beds to prevent invasive overgrowth. Despite its aggressive nature, mint contributes positively to garden ecosystems by repelling pests such as ants, mosquitoes, and aphids while simultaneously attracting beneficial insects like bees and butterflies.

Culinary uses of mint are extensive and culturally diverse. Fresh leaves flavor teas, chutneys, salads, sauces, and desserts, while dried leaves are used in spice blends. Mint is essential in Middle Eastern, Mediterranean, and South Asian cuisines, and its cooling properties are prized in beverages such as mojitos and mint teas. Medicinally, mint has been valued since ancient times. The Greeks used it to aid digestion and freshen breath, while traditional medicine systems worldwide recognize its soothing effects on the stomach, respiratory tract, and nervous system.

Ecologically, mint’s adaptability makes it an asset for sustainable gardening, as it requires minimal inputs and enriches biodiversity. Its global spread demonstrates its enduring relevance, linking ancient traditions with modern lifestyles. Today, mint remains one of the most versatile herbs, balancing practical utility with ecological benefits in gardens worldwide."
24,Henna,Lawsonia inermis,https://i.redd.it/bnnshsueinaa1.jpg,"Did you know Henna leaves can cool the skin, used in hot climates for relief?",Did you know Henna plants can produce dye for over 10 years without replanting?,Did you know Henna was used in ancient Persia to decorate bridal hands?,"Hair dye: Henna leaves produce natural orange dye for safe, long-lasting hair coloring.",Body art: Henna’s dye creates intricate temporary tattoos for cultural ceremonies globally.,Medicinal uses: Henna leaves cool skin and treat ailments in traditional remedies.,Middle East,Arid to Semi-arid,Shrub,Used in cultural ceremonies,"Henna (Lawsonia inermis) is a flowering shrub native to the Middle East, North Africa, and South Asia, widely cultivated for its cultural, cosmetic, and medicinal significance. Reaching heights of 6–20 feet, henna bears small, oval-shaped green leaves, fragrant clusters of white to pinkish flowers, and tiny fruits containing seeds. Its leaves, when dried, ground, and mixed into a paste, yield a natural orange-red dye that has been used for centuries in body art, hair coloring, and textile decoration.

Thriving in arid and semi-arid climates, henna grows best in sandy or loamy soils with ample sunlight and minimal water requirements. Its deep root system enables survival in hot, dry regions, making it an excellent choice for sustainable landscaping and soil conservation. As a hardy, drought-tolerant species, henna plays an important role in reducing erosion and maintaining ecological balance in challenging environments.

Culturally, henna holds immense symbolic value. It is integral to traditional ceremonies such as weddings, religious festivals, and rites of passage in countries across the Middle East, India, and North Africa. Intricate designs applied to the hands and feet using henna paste represent beauty, protection, and blessings. Beyond body art, henna dye has been historically used to color fabrics, leather, and even animal coats.

Medicinally, henna has long been utilized in traditional systems of healing. It possesses cooling, antimicrobial, and anti-inflammatory properties, making it useful in soothing skin conditions, burns, and minor wounds. Its flowers are also used in perfumes and traditional remedies.

Globally, henna continues to support cultural industries, cosmetic applications, and eco-friendly practices. Its combination of resilience, cultural richness, and versatile utility ensures its continued importance in both heritage traditions and sustainable living."
25,Jackfruit,Artocarpus heterophyllus,https://images.pexels.com/photos/6871013/pexels-photo-6871013.jpeg,"Did you know Jackfruit seeds can be roasted as a nutty, protein-rich snack?",Did you know Jackfruit trees can produce fruits weighing up to 80 pounds?,Did you know Jackfruit latex is used as a natural adhesive in traditional crafts?,"Fruit production: Jackfruit’s large, protein-rich fruits are a dietary staple in tropical regions.",Silkworm feed: Jackfruit leaves provide nourishment for silkworms in sericulture industries.,Shade provider: Jackfruit’s broad canopy offers cooling shade in tropical landscapes.,Southeast Asia,Tropical,Tree,Staple in regional diets,"Jackfruit (Artocarpus heterophyllus) is a large, evergreen tree native to the rainforests of South and Southeast Asia, particularly India, Bangladesh, and the Malay Peninsula. It is one of the largest fruit-bearing trees in the world, reaching heights of 50–70 feet with a broad canopy and glossy, leathery leaves that provide dense shade. The tree produces massive, oblong fruits that can weigh up to 80 pounds, making them the largest tree-borne fruits on Earth.

The jackfruit tree thrives in tropical lowlands with warm temperatures, high humidity, and well-drained soils. Its deep root system allows it to withstand seasonal droughts, while its tolerance to heat and humidity ensures steady growth. The tree’s presence enriches ecosystems, offering food and shelter for birds, insects, and small animals. Its dense canopy helps prevent soil erosion and promotes biodiversity in agroforestry systems.

Jackfruit has played a central role in food security for centuries. Its fruit, rich in carbohydrates, vitamins, and minerals, serves as a staple food in many cultures. Young, unripe jackfruit is cooked as a vegetable, often used in curries and stews, while ripe jackfruit provides a sweet, fragrant pulp enjoyed fresh or dried. The seeds are edible when roasted or boiled, adding further nutritional value.

Historically, jackfruit cultivation dates back thousands of years in India, where it was celebrated in ancient texts and traditional cuisines. Beyond food, the tree contributes significantly to local economies. Its durable, golden-hued wood is prized for small-scale construction, furniture, and musical instruments. Additionally, its leaves are used to feed silkworms and livestock, highlighting its agricultural versatility.

As a resilient, multipurpose species, jackfruit remains essential in sustainable farming practices, supporting ecological balance, cultural traditions, and community livelihoods across tropical regions worldwide."
26,Fig,Ficus carica,https://glut.co.uk/wp-content/uploads/2022/12/Close-up-figs.jpg,"Did you know Fig trees can grow on cliffs, anchoring with strong roots?",Did you know Fig leaves were used in ancient art to symbolize modesty?,"Did you know Fig fruits can ripen year-round in warm climates, aiding food supply?","Culinary wraps: Fig leaves wrap foods, imparting flavor in Mediterranean culinary traditions.","Fruit production: Fig trees yield sweet fruits, a staple in global diets.",Ornamental planting: Fig’s broad leaves and fruits enhance Mediterranean and subtropical gardens.,Mediterranean,Temperate to Subtropical,Tree,Ancient fruit crop,"Fig (Ficus carica) is a small, deciduous tree native to the Mediterranean and Western Asia, widely cultivated for thousands of years as one of the earliest domesticated fruit crops. Typically reaching 10–30 feet in height, the fig tree has a spreading habit with smooth, gray bark and broad, lobed leaves that give it a distinctive appearance. The leaves are rough to the touch and, when broken, release a white, milky latex that has been used traditionally for medicinal and culinary purposes.

The tree thrives in regions with long, hot summers and mild winters. It prefers full sun and well-drained soils, showing remarkable tolerance to drought once established. While figs grow best in warm, temperate to subtropical climates, they are adaptable and can be cultivated in containers in cooler regions, allowing for global spread.

The fruits of the fig tree, technically inverted flowers called syconia, are renowned for their sweet, honey-like flavor and soft, chewy texture. They are consumed fresh, dried, or processed into jams, pastries, and health foods, contributing to global cuisines. Nutritionally, figs are rich in fiber, calcium, iron, and antioxidants, making them a valuable food for promoting digestion and overall wellness.

Historically, figs hold deep cultural and symbolic significance. They were cultivated in ancient Mesopotamia, Egypt, and Greece, often associated with fertility, abundance, and prosperity. References to figs appear in religious texts and folklore across civilizations, underlining their cultural importance.

Ecologically, fig trees support biodiversity by providing food for birds, insects, and mammals. Their dense canopy offers shade and shelter in gardens and landscapes. In sustainable agriculture, fig trees are valued for their resilience, productivity, and low maintenance needs, making them ideal for small-scale farmers and home gardeners alike.

Today, figs continue to enrich diets, traditions, and ecosystems worldwide."
27,Teak,Tectona grandis,https://forestry.com/wp/wp-content/uploads/2023/09/2-6.webp,"Did you know Teak leaves can absorb heavy metals, aiding soil remediation?","Did you know Teak wood resists water, used in boat-building for centuries?","Did you know Teak trees can live over 100 years, outlasting many hardwoods?",Timber production: Teak’s durable wood is used for furniture and shipbuilding globally.,"Food packaging: Teak leaves wrap foods, preserving freshness in traditional Asian practices.",Shade provider: Teak’s large canopy provides cooling shade in tropical environments.,Southeast Asia,Tropical,Tree,Valued for durable wood,"Teak (Tectona grandis) is a large, deciduous tropical hardwood tree native to Southeast Asia, particularly India, Myanmar, Thailand, and Laos. It is one of the most valuable and widely cultivated timber species in the world, growing to impressive heights of 100–130 feet with a straight trunk and spreading crown. The tree produces large, rough, papery leaves and clusters of small, fragrant white flowers during the blooming season. Teak is a seasonal shedder, losing its leaves in the dry months and regenerating vigorously with the onset of rains.

The wood of teak is world-renowned for its durability, strength, and natural resistance to pests, termites, and fungal decay. Its high content of natural oils makes it water-resistant, which is why it has been historically prized for shipbuilding, boat decks, and outdoor structures. Today, teak continues to be a preferred material for high-quality furniture, flooring, cabinetry, and luxury interiors. Beyond timber, its large leaves are traditionally used in food wrapping, thatching, and even as natural dye sources.

Ecologically, teak thrives in tropical and subtropical climates with well-drained, deep alluvial soils. It requires high temperatures, seasonal rainfall, and abundant sunlight, making it suitable for both natural forests and managed plantations. In sustainable forestry, teak is highly valued due to its relatively fast growth compared to other hardwoods, providing economic opportunities for local communities while reducing pressure on natural forests.

Historically, teak wood was used extensively in shipbuilding by ancient Indian and Southeast Asian civilizations, later adopted by European powers for naval fleets. Its reputation for long-lasting performance ensured its global demand for centuries.

In modern contexts, teak remains central to global timber markets, while plantations contribute to reforestation efforts and carbon sequestration. Its ecological adaptability, economic value, and cultural legacy secure its place as one of the world’s most important tree species."
