date,plant_name,botanical_name,image_url,fact_1,fact_2,fact_3,use_1,use_2,use_3,region,habitat,category,history,description
1,Neem,Azadirachta indica,https://images.pexels.com/photos/13666672/pexels-photo-13666672.jpeg,"Did you know Neem can purify air by absorbing pollutants, making it a natural air filter in urban areas?","Did you know Neem seeds produce oil that can fuel lamps, offering a sustainable light source in rural regions?",Did you know Neem twigs were historically used as natural toothbrushes in India due to their antibacterial properties?,"Insect repellent: Neem leaves emit compounds that naturally deter pests, protecting crops and homes.",Medicinal extracts: Neem bark and seeds yield oils for treating skin infections and inflammation.,Shade provider: Neem’s dense canopy offers cooling shade in tropical urban and rural areas.,South Asia,Tropical,Tree,Used in Ayurvedic medicine for centuries,"Neem (Azadirachta indica) is a fast-growing evergreen tree native to South Asia, flourishing in tropical and subtropical climates. Its compound, sharply toothed leaves form a serrated pattern that aids water retention while naturally resisting pests. Typically reaching 50 to 65 feet in height, neem is valued for its spreading crown and dense shade, making it a familiar feature of both rural villages and urban landscapes.

Every part of the tree holds remarkable utility. The leaves, bark, and seeds are central to Ayurvedic medicine, where they are used to treat skin disorders, infections, and inflammation thanks to potent antibacterial, antifungal, and anti-inflammatory compounds. Neem leaves are also applied in organic pest control, serving as a natural insect repellent without harmful chemicals. Crushed leaves are incorporated into soothing face packs, while neem oil, pressed from the seeds, is widely used in cosmetics, hair treatments, soaps, and eco-friendly repellents.

Ecologically, neem thrives even in poor, dry soils, where its hardy root system helps stabilize land, reduce erosion, and restore degraded environments. Its small, fragrant white flowers attract bees, butterflies, and other pollinators, supporting biodiversity. The dense canopy provides shelter for birds and small mammals, creating microhabitats in otherwise challenging environments.

Culturally, neem carries deep significance across South Asia. It is commonly planted near homes and temples for spiritual protection and blessings. The wood, notable for its durability and natural termite resistance, is used in construction, agricultural tools, and furniture.

Today, neem is cultivated far beyond its native range, including Africa, Australia, and the Americas. Its resilience, low water requirements, and rapid growth make it ideal for reforestation and climate-adaptation projects. Combining medicinal, agricultural, ecological, and cultural value, neem stands as a versatile and sustainable species benefiting both people and the environment worldwide."
2,Maple,Acer palmatum,https://images.pexels.com/photos/707668/pexels-photo-707668.jpeg,"Did you know Maple trees can predict weather, with leaves curling inward before heavy rain?",Did you know Maple wood is so resonant it’s used to craft high-quality violins and guitars?,"Did you know Maple sap can take 40 gallons to produce just one gallon of syrup, showcasing its concentrated sweetness?","Syrup production: Maple sap is boiled to create sweet syrup, a North American delicacy.","Ornamental landscaping: Maple’s vibrant fall foliage enhances gardens, parks, and urban aesthetic spaces.","Symbol in Canada: Maple leaf represents national identity, featured on flags and cultural icons.",Temperate Northern Hemisphere,Temperate,Tree,Iconic in Canadian culture,"Maple trees (Acer palmatum) are deciduous and celebrated worldwide for their striking ornamental leaves that transform into vibrant red, orange, and yellow shades in autumn. Native to East Asia, they flourish in temperate climates, adapting easily to seasonal variations. Their distinctive palm-like leaves, typically with five to nine lobes, maximize sunlight absorption during the growing season and contribute to their dazzling fall display.

Generally reaching heights of 15 to 25 feet, maples are prized in gardens, parks, and urban landscapes for their graceful form and foliage. They are also cultivated as bonsai specimens, where their delicate yet resilient leaves embody harmony and artistic refinement. Some species, such as Acer saccharum (sugar maple), provide the sap used to produce maple syrup, an iconic culinary product in North America. The maple leaf is also recognized as Canada’s national symbol, appearing prominently on its flag.

Maple wood, dense and beautifully grained, is highly valued in furniture making, flooring, and musical instruments like violins and guitars. Beyond aesthetics and practical use, maples provide dense shade, support pollinators such as bees, and play a vital ecological role. Their distinctive winged samara seeds, often called “helicopters,” disperse effectively by wind, ensuring natural regeneration and widespread growth.

Historically, maples have been planted in towns and cities to improve air quality, tolerate pollution, and provide cooling shade. Regions such as New England, where autumn foliage draws millions of visitors annually, benefit economically from the seasonal spectacle. Ecologically, maple trees stabilize soils, conserve moisture, and create habitats for birds, insects, and small mammals.

In Japanese culture, maples symbolize balance, peace, and renewal, appearing in traditional art, gardens, and festivals. With numerous cultivated varieties tailored to diverse climates and aesthetic needs, maples remain among the most beloved trees globally, admired for their adaptability, resilience, and enduring beauty."
3,Mango,Mangifera indica,https://images.pexels.com/photos/16537239/pexels-photo-16537239.jpeg,"Did you know Mango trees can produce fruit for over 300 years, outliving many other fruit trees?","Did you know Mango leaves are used in Indian weddings to decorate entrances, symbolizing prosperity?",Did you know Mango bark can be brewed into a tea that helps treat diarrhea in traditional remedies?,"Fruit production: Mango trees yield juicy fruits, a dietary staple in tropical cuisines worldwide.",Water purity testing: Mango leaves’ chemical properties help assess water quality in biological research.,Ornamental shade: Mango’s broad canopy provides aesthetic shade in orchards and urban landscapes.,South Asia,Tropical,Tree,Cultivated for millennia in India,"Mango trees (Mangifera indica) are majestic evergreen species native to South Asia, thriving in tropical and subtropical climates. Known as the “king of fruits,” mangoes have been cultivated for over 4,000 years, spreading across Southeast Asia, Africa, and the Americas through trade and exploration. These long-lived giants can grow more than 100 feet tall and survive for centuries, their resilience making them essential to agriculture, ecology, and culture.

The leaves, leathery and lance-shaped, emerge reddish before maturing to a glossy deep green. They play a vital role in energy storage during fruiting and are also used in biological studies to test water purity due to their chemical composition. The tree’s dense, spreading canopy provides extensive shade, stabilizes soils, and prevents erosion with its deep root system. Orchards and urban landscapes benefit from the cooling shelter mango trees create, while birds, insects, and small mammals find refuge within their branches.

Mango fruits, juicy and aromatic, are integral to cuisines worldwide, consumed fresh or processed into juices, chutneys, and desserts. Varieties differ in flavor, size, and disease resistance, ensuring global adaptability. Culturally, mangoes hold great significance in India, symbolizing prosperity and fertility, often used in festivals, weddings, and religious rituals. Mango leaves decorate doorways during celebrations, representing blessings and protection.

Medicinally, both the leaves and bark are incorporated into traditional remedies for digestive issues, diabetes, and skin ailments. Mango wood, though less valued compared to fruit production, is still used in furniture, construction, and carvings due to its workable texture.

With ample sunlight and well-drained soil, mango trees yield abundant harvests, sometimes year-round in favorable climates. Beyond their economic and nutritional value, mangoes enrich biodiversity, support food security, and embody deep cultural heritage, making them one of the world’s most treasured and enduring fruit trees."
4,Guava,Psidium guajava,https://images.pexels.com/photos/29080042/pexels-photo-29080042.jpeg,Did you know Guava leaves can reduce acne when applied as a paste due to their antimicrobial properties?,"Did you know Guava trees can produce up to 100 pounds of fruit annually, supporting food security?",Did you know Guava wood is so durable it’s used for carving tools in tropical regions?,Medicinal teas: Guava leaves are brewed into teas to boost immunity and treat digestive issues.,Mouthwash ingredient: Guava leaf extracts with antibacterial properties enhance oral hygiene products.,"Antioxidant source: Guava fruits and leaves provide antioxidants, supporting health and wellness.",Tropical Americas,Tropical,Tree,Used in traditional medicine,"Guava (Psidium guajava) is a fast-growing evergreen tree native to tropical regions of the Americas, now cultivated widely across Asia, Africa, and Oceania. Thriving in warm, humid climates, guava trees are prized for their adaptability, resilience, and nutritional fruits. Typically reaching 10 to 30 feet in height, they are grown both in orchards and household gardens for their reliable yields and medicinal benefits.

The tree’s broad, oval leaves have a slightly rough texture and are rich in essential oils, flavonoids, and tannins that contribute to its natural defenses. When crushed, the leaves release a distinct sweet aroma and are used in teas to boost immunity, manage digestive disorders, and control blood sugar levels. Modern studies have confirmed their antibacterial and antioxidant properties, making them useful in natural mouthwashes and traditional remedies.

Guava fruits are round to pear-shaped, with thin green or yellow skin and pink or white flesh packed with vitamin C, fiber, and antioxidants. They are consumed fresh or processed into juices, jams, jellies, and desserts, playing a vital role in culinary traditions across Latin America, the Caribbean, and Asia. The fruiting season often occurs multiple times per year, enhancing its value in tropical agriculture and supporting food security.

Ecologically, guava trees are adaptable to varied soils but thrive best in well-drained, fertile conditions with ample sunlight. Their dense canopy provides shade, stabilizes soil, and attracts pollinators like bees, contributing to biodiversity. However, their shallow root system requires management to prevent invasiveness in non-native areas.

Culturally, guava holds significance in folklore and daily life, often symbolizing abundance and health. Its rapid growth, ornamental appeal, and consistent yields make it a staple of sustainable farming systems. Combining ecological, medicinal, and nutritional benefits, guava stands as one of the most versatile and widely cherished fruit trees worldwide."
5,Peepal,Ficus religiosa,https://images.pexels.com/photos/26831573/pexels-photo-26831573.jpeg,"Did you know Peepal trees release oxygen at night, unlike most plants, aiding urban air quality?","Did you know Peepal leaves are used as natural plates in Indian rituals, blending tradition with sustainability?","Did you know Peepal trees can host over 100 bird species, creating vibrant urban ecosystems?","Shade provider: Peepal’s wide canopy offers cooling shade, ideal for urban and rural settings.","Biodiversity support: Peepal’s figs and foliage sustain birds and insects, enhancing urban ecosystems.","Religious ceremonies: Peepal leaves are used in Hindu and Buddhist rituals, symbolizing enlightenment.",South Asia,Tropical,Tree,Sacred in Buddhism and Hinduism,"Peepal (Ficus religiosa) is a large, fast-growing tree native to South Asia, thriving across tropical and subtropical regions. Recognizable by its heart-shaped leaves with elongated tips and broad bases, the peepal has light, flexible foliage that flutters even in mild breezes. This movement aids rainwater drainage and minimizes wind stress, while its wide canopy provides dense shade and shelter. Mature trees typically reach 60 to 100 feet in height, with lifespans that often extend for centuries, making them enduring landmarks in both rural and urban landscapes.

Ecologically, the peepal is highly valuable. Its extensive root system stabilizes soils, prevents erosion, and supports water retention in degraded areas. The small figs produced by the tree are an important food source for birds, bats, and insects, thereby enriching local biodiversity. Its resilience in polluted environments makes it an excellent choice for urban planting, where it improves air quality and provides green cover in heavily built-up areas.

Medicinally, the leaves, bark, and seeds are integral to Ayurveda, used to treat respiratory disorders, skin ailments, and digestive issues. Traditional practices also employ dried leaves for wound healing and seeds in herbal formulations. The wood, though soft and less durable, is occasionally used for small crafts, though felling is rare due to cultural reverence.

Culturally and spiritually, the peepal holds immense importance. In Hinduism, it symbolizes protection and prosperity, while in Buddhism it is revered as the Bodhi tree under which Siddhartha Gautama attained enlightenment. Its leaves are used in rituals, offerings, and as natural plates in rural communities. Frequently planted near temples and homes, the tree embodies sanctity, endurance, and wisdom.

Today, the peepal is cultivated across Southeast Asia and beyond, where it continues to serve ecological, medicinal, and cultural purposes, blending practical value with profound spiritual symbolism."
6,Banyan,Ficus benghalensis,https://images.pexels.com/photos/709543/pexels-photo-709543.jpeg,"Did you know Banyan trees can create microclimates, cooling areas beneath their massive canopies?","Did you know Banyan figs are a key food source for monkeys and bats, supporting tropical biodiversity?",Did you know Banyan roots were historically used to make ropes in rural Asian communities?,Shade provider: Banyan’s massive canopy creates cool microclimates for community gatherings in tropics.,"Carbon sequestration: Banyan’s extensive growth absorbs significant carbon, aiding climate regulation efforts.",Habitat creation: Banyan’s aerial roots and canopy provide homes for diverse tropical wildlife.,South Asia,Tropical,Tree,Cultural symbol in India,"Banyan (Ficus benghalensis) is a majestic evergreen tree native to South Asia, renowned for its vast canopy and remarkable aerial roots that grow into the ground to form secondary trunks. This unique growth habit allows the tree to spread horizontally across large areas, sometimes covering acres, creating the impression of a forest supported by a single organism. Mature banyans often reach heights of 100 feet, with their immense spread offering dense shade and cooling microclimates in tropical regions.

Ecologically, banyans are keystone species, providing food, shelter, and habitat for countless creatures. Their figs are consumed by birds, bats, monkeys, and insects, supporting complex food webs and aiding seed dispersal. The dense foliage offers nesting sites for wildlife, while the extensive root systems stabilize soil, prevent erosion, and help retain groundwater. Their vast biomass also makes banyans significant carbon sinks, contributing to climate regulation.

In traditional medicine, the leaves, bark, and aerial roots are valued in Ayurveda for their anti-inflammatory, antimicrobial, and wound-healing properties. Poultices from the bark are used to treat skin conditions, while aerial root extracts are applied for dental care and digestive health. Despite having workable wood, banyans are rarely felled due to their immense ecological and cultural significance.

Culturally, the banyan is deeply symbolic in India and neighboring regions, representing longevity, endurance, and eternal life. These trees often serve as communal gathering spots, courtyards, and meeting places, historically planted along roads and marketplaces for shade and social interaction. Many ancient banyans remain as revered landmarks, entwined with folklore and spirituality, often associated with deities and temple complexes.

Beyond South Asia, banyans have been introduced to Africa, Australia, and other tropical areas, where they continue to adapt and thrive. With their ecological resilience, cultural importance, and breathtaking presence, banyans stand as living monuments of nature and heritage."
7,Tulsi,Ocimum tenuiflorum,https://images.pexels.com/photos/32112349/pexels-photo-32112349.jpeg,"Did you know Tulsi plants can repel snakes due to their strong aroma, acting as a natural deterrent?","Did you know Tulsi leaves can boost memory when consumed as tea, per Ayurvedic studies?","Did you know Tulsi is planted in Indian courtyards to ward off negative energy, a spiritual tradition?",Herbal teas: Tulsi leaves are brewed into teas for respiratory health and stress relief benefits.,"Medicinal remedies: Tulsi’s antimicrobial oils treat colds, skin conditions in Ayurvedic practices.","Pollinator attraction: Tulsi’s flowers draw bees and butterflies, boosting garden biodiversity effectively.",Pollinator attraction,South Asia,Tropical,Herb,"Tulsi (Ocimum tenuiflorum), also known as holy basil, is a small, bushy perennial herb native to South Asia, thriving in tropical and subtropical climates. Reaching 1 to 2 feet in height, it features aromatic, slightly hairy leaves that range in color from green to purplish hues. When touched or crushed, the leaves release a sharp, clove-like fragrance attributed to their rich essential oil content. Tulsi prefers well-drained soils and full sun, making it an easy-to-grow plant in gardens, courtyards, and temple spaces.

Medicinally, tulsi is central to Ayurvedic practices, where it is valued for its broad therapeutic range. Its leaves are brewed into herbal teas that relieve respiratory issues, reduce stress, and enhance immunity. Compounds within the plant exhibit antimicrobial, antifungal, and anti-inflammatory properties, making tulsi effective in natural remedies for colds, fevers, and skin conditions. Modern scientific research has validated its antioxidant benefits, linking it to cardiovascular health, stress reduction, and overall wellness.

Culturally, tulsi holds sacred status in Hinduism, where it symbolizes purity, devotion, and protection. Many households in India and Nepal grow tulsi in earthen pots or courtyards, often as part of daily worship rituals. Its presence near temples reflects its spiritual significance, believed to invite blessings and ward off negative energies. Ritual offerings and festivals frequently involve tulsi leaves, underscoring their religious importance.

Ecologically, tulsi enhances biodiversity by attracting bees, butterflies, and other pollinators with its small purple flowers, supporting local ecosystems. Its rapid growth, resilience, and low maintenance requirements make it ideal for sustainable gardening. The plant’s seeds propagate easily, ensuring continuous cultivation across regions.

Beyond South Asia, tulsi has spread globally to areas such as Africa, the Caribbean, and parts of the Americas, where it is valued for its adaptability, medicinal use, and culinary flavoring."
8,Eucalyptus,Eucalyptus globulus,https://images.pexels.com/photos/6168330/pexels-photo-6168330.jpeg,"Did you know Eucalyptus leaves can be used to dye fabrics, producing natural blue-green hues?","Did you know Eucalyptus trees can absorb massive amounts of water, helping drain swampy lands?","Did you know Eucalyptus oil can relieve muscle pain when used in massages, a common global remedy?",Essential oil production: Eucalyptus leaves yield antiseptic oils for cough drops and aromatherapy products.,"Timber source: Eucalyptus wood is used for durable furniture, paper, and construction materials.",Landscaping: Eucalyptus trees enhance landscapes with their fast growth and aesthetic appeal.,Landscaping,Australia,Temperate to Tropical,Tree,"Eucalyptus (Eucalyptus globulus) is a fast-growing evergreen tree native to Australia, where it dominates landscapes from coastal areas to inland plains. Known for its smooth, peeling bark and long, leathery leaves, eucalyptus can reach 60 feet within its first decade and ultimately grow to 100–200 feet in height. The tree annually sheds bark in strips or patches, renewing its surface and maintaining healthy growth. Its foliage contains aromatic oils with strong antiseptic properties, widely used in cough drops, balms, vaporizers, and aromatherapy.

Ecologically, eucalyptus plays an essential role in its native habitat. Its leaves provide the primary food source for koalas, while the dense canopy offers shade and shelter in arid environments. The deep root system stabilizes soils, prevents erosion, and accesses groundwater reserves, enabling survival in drought-prone regions. However, eucalyptus also releases volatile oils into the atmosphere, improving air freshness but increasing flammability, which requires careful management in fire-prone ecosystems.

Economically, eucalyptus is one of the most important plantation trees worldwide. Its rapid growth and adaptability make it a reliable source of timber, pulpwood, and fuel. The durable wood is used in flooring, furniture, and construction, while its fibers are essential to the paper industry. Eucalyptus oil, distilled from the leaves, is a valuable export commodity used in cosmetics, cleaning products, and pharmaceuticals.

Culturally, eucalyptus has long been significant to Indigenous Australians, who utilized its bark, leaves, and gum for medicine, tools, and ceremonial practices. Its medicinal uses—such as treating coughs, fevers, and infections—have been passed down for generations.

Today, eucalyptus is cultivated globally across Africa, Asia, and the Americas, where it supports reforestation, provides windbreaks, and enhances rural economies. With its ecological resilience, medicinal value, and industrial uses, eucalyptus remains a cornerstone of sustainable forestry and landscaping worldwide."
9,Lemon,Citrus limon,https://images.pexels.com/photos/2872846/pexels-photo-2872846.jpeg,"Did you know Lemon leaves can deter moths when placed in closets, acting as a natural repellent?",Did you know Lemon trees can produce up to 600 pounds of fruit annually in ideal conditions?,"Did you know Lemon peel oil is used in perfumes, adding a fresh, citrusy note?","Culinary flavoring: Lemon leaves and fruit add zesty flavor to teas, meats, and desserts.",Ornamental planting: Lemon trees’ glossy leaves and fruits beautify gardens and urban spaces.,"Fruit production: Lemon fruits, rich in vitamin C, are a global dietary staple.",Mediterranean,Tropical to Subtropical,Tree,Cultivated since ancient times,"Lemon (Citrus limon) is a small evergreen tree native to the Mediterranean region, prized worldwide for its aromatic leaves, fragrant blossoms, and tangy fruits. Typically growing 10 to 20 feet tall, lemon trees feature glossy, ovate leaves rich in essential oils that release a refreshing citrus scent when crushed. These oils, found in both leaves and peels, contribute to the plant’s resilience and extensive culinary and medicinal uses.

Thriving in warm, sunny climates, lemon trees prefer well-drained, slightly acidic soils and require consistent watering. Although sensitive to frost, they flourish in subtropical and tropical regions, producing fruit year-round under favorable conditions. Their white, fragrant flowers attract bees and other pollinators, supporting biodiversity and ensuring steady yields. The dense foliage provides modest shade, making the tree valuable in orchards, gardens, and household courtyards.

Lemon fruit is a dietary staple, celebrated for its high vitamin C content, which supports immunity and overall health. Beyond fresh consumption, lemons are processed into juices, teas, desserts, marinades, and cleaning agents. The zest and leaves impart a distinctive flavor to culinary dishes, while the peel and essential oil are used in skincare, perfumes, and household remedies. Traditional medicine employs lemon for digestion, detoxification, and skin treatments, highlighting its multifunctional benefits.

Culturally, lemons symbolize vitality, freshness, and purification. They hold importance in Mediterranean traditions, South Asian rituals, and global cuisines, often representing prosperity and well-being. Historically, lemons were cultivated in ancient societies and spread via trade routes to Asia, Africa, and the Americas, becoming integral to agriculture and daily life worldwide.

Today, lemons are cultivated on a global scale in regions such as California, India, and Australia, where they support food security and sustainable farming. Combining economic, ecological, and cultural value, lemon trees remain essential contributors to nutrition, medicine, and heritage."
