date,plant_name,botanical_name,image_url,fact_1,fact_2,fact_3,use_1,use_2,use_3,region,habitat,category,history,description
28,Lemongrass,Cymbopogon citratus,https://victoriananursery.co.uk//images/800/lemon-grass-001.jpg,"Did you know Lemongrass can repel ticks, protecting livestock in rural areas?",Did you know Lemongrass stalks are used as skewers in Southeast Asian cooking?,Did you know Lemongrass oil is used in candles for its calming scent?,Culinary flavoring: Lemongrass stalks add lemony flavor to Southeast Asian dishes and teas.,"Insect repellent: Lemongrass’s scent deters ticks and insects, protecting livestock and gardens.",Herbal teas: Lemongrass leaves are brewed into calming teas for digestive benefits.,Southeast Asia,Tropical,Grass,Used in Asian cuisine,"Lemongrass (Cymbopogon citratus) is a perennial tropical grass native to Southeast Asia and widely cultivated across tropical and subtropical regions. It grows in dense clumps that can reach 3–6 feet in height, with long, slender, arching leaves that release a strong lemon-like aroma when crushed. The plant is characterized by its fibrous stalks and distinctive citrus fragrance, which comes from its high citral content.

Lemongrass thrives in warm, humid climates with full sun exposure and well-drained soils. It is relatively low-maintenance, tolerant of drought once established, and spreads quickly, making it ideal for both home gardens and large-scale cultivation. Its clumping growth habit also helps in erosion control and improving soil structure. Traditionally, lemongrass has been used in crop rotations to naturally repel pests due to its strong scent, contributing to eco-friendly farming practices.

Culinarily, lemongrass is a staple in Southeast Asian cuisines, especially Thai, Vietnamese, and Indonesian dishes. Its stalks and leaves are used to flavor soups, curries, teas, and marinades. Fresh or dried, it provides a tangy citrus flavor without the acidity of lemon. Beyond the kitchen, lemongrass is valued for its medicinal properties. In traditional medicine, it has been used as a remedy for digestive issues, fevers, and infections. Its essential oil, rich in citral, is used in aromatherapy, cosmetics, and natural insect repellents.

Historically, lemongrass has been cultivated for centuries across Asia, not only for culinary purposes but also for medicinal and ritual uses. Its role in traditional healing practices continues to be recognized globally.

In sustainable agriculture, lemongrass contributes to biodiversity by supporting pollinators and deterring harmful insects. Its rapid growth and multifunctional uses—culinary, medicinal, and ecological—make it one of the most valuable plants for both small-scale gardeners and commercial industries worldwide."
29,Ginkgo,Ginkgo biloba,https://www.thetreecenter.com/c/uploads/2014/06/ginkgo-tree-2-jpg-webp.jpg,"Did you know Ginkgo seeds are eaten in Asia, believed to boost stamina?","Did you know Ginkgo trees can survive nuclear radiation, as seen in Hiroshima?",Did you know Ginkgo leaves are used in teas to improve circulation?,Medicinal extracts: Ginkgo leaves yield extracts for cognitive health in traditional medicine.,Ornamental planting: Ginkgo’s fan-shaped leaves enhance urban landscapes with aesthetic appeal.,"Air purification: Ginkgo trees tolerate pollution, improving air quality in urban settings.",Air purification,East Asia,Temperate,Tree,"Ginkgo (Ginkgo biloba) is a unique deciduous tree native to East Asia, particularly China, where it has been cultivated for thousands of years. Often called a “living fossil,” ginkgo is the only surviving species of an ancient plant group that dates back more than 200 million years. Mature trees typically grow 50–80 feet tall, with some specimens reaching even greater heights in favorable conditions. The tree is easily recognized by its distinctive fan-shaped leaves, which turn a brilliant golden yellow in autumn, creating striking seasonal displays.

One of ginkgo’s most remarkable qualities is its resilience. It thrives in a wide range of soils, tolerates drought once established, and demonstrates exceptional resistance to pests, diseases, and urban pollution. These qualities make it an excellent choice for city landscapes, where it is often planted along streets, in parks, and around public spaces. Its longevity is legendary, with some trees known to live for more than a thousand years.

Medicinally, ginkgo has a long history of use in traditional Chinese medicine, where extracts from its leaves were valued for promoting circulation and supporting cognitive health. Modern research continues to investigate its potential in improving memory, focus, and overall brain function. The seeds, though used in traditional cuisines, require careful preparation due to their toxicity if consumed in excess.

Historically, ginkgo trees were considered sacred and planted around temples in China, Korea, and Japan. Their survival after the atomic bombing of Hiroshima further symbolizes their resilience, as several trees near the blast zone sprouted new growth shortly afterward.

Ecologically, ginkgo trees contribute to urban biodiversity by providing shade, improving air quality, and supporting pollinators when their flowers bloom. With its unique evolutionary heritage, cultural significance, and environmental adaptability, ginkgo remains one of the world’s most valued and enduring trees."
30,Oak,Quercus robur,https://arboretum.rowan.edu/wp-content/uploads/2023/06/RU-Willow-Oak-547-0009.jpg,"Did you know Oak trees can support over 1,000 insect species, boosting ecosystems?",Did you know Oak bark was used to tan leather in medieval Europe?,Did you know Oak acorns were a staple food for ancient indigenous tribes?,Timber production: Oak’s strong wood is used for furniture and construction in Europe.,Wildlife food: Oak acorns provide essential nutrition for birds and mammals in ecosystems.,Shade provider: Oak’s broad canopy offers cooling shade in temperate landscapes.,Europe,Temperate,Tree,Symbol of strength in folklore,"Oak (Quercus robur) is a majestic deciduous tree native to Europe and widely admired for its strength, durability, and ecological importance. Commonly known as the English oak, this species can reach heights of 50–100 feet, with some ancient specimens surviving for several centuries and even surpassing a thousand years. Its broad crown and sturdy branches provide shade and shelter for countless organisms, while its deeply lobed, leathery leaves are easily recognizable.

One of the oak’s defining features is its acorns, which serve as a vital food source for birds, squirrels, deer, and other wildlife. By supporting such diverse animal populations, oaks play a central role in temperate forest ecosystems. Their fallen leaves enrich the soil, encouraging nutrient cycling and supporting the growth of surrounding plants. The oak’s strong and durable wood has been valued for centuries, traditionally used in shipbuilding, furniture, and flooring, and continues to be highly sought after in sustainable forestry.

Historically, oaks held deep symbolic significance in European culture, representing strength, endurance, and wisdom. They were sacred to ancient Celtic and Norse peoples, often associated with gods of thunder and sky. Many traditional ceremonies took place beneath their branches, cementing the oak as a cultural icon in European folklore.

Ecologically, oaks are biodiversity hotspots, providing habitats for insects, fungi, birds, and mammals. A single oak tree can host hundreds of species, making it a keystone organism in woodland ecosystems. They thrive in temperate climates with well-drained soils, where their slow growth and long lifespan contribute to forest stability.

Today, oaks remain central to conservation and sustainable forestry efforts. Their resilience, ecological contributions, and cultural heritage ensure their continued importance. As symbols of endurance and guardians of biodiversity, oak trees remain among the most treasured and ecologically significant trees in the world."
31,Pomegranate,Punica granatum,https://plantmegreen.com/cdn/shop/files/Pomegranate_b09b55fc-82b0-43d3-a897-1454d805805b.jpg?v=1736453685&width=1500,"Did you know Pomegranate seeds can remain viable for years, aiding replanting?",Did you know Pomegranate juice was used as a natural ink in ancient times?,Did you know Pomegranate trees can produce fruit in their first year?,Fruit production: Pomegranate’s antioxidant-rich fruits are used in juices and culinary dishes.,Medicinal extracts: Pomegranate seeds and rind treat inflammation in traditional remedies.,Ornamental gardening: Pomegranate’s vibrant flowers and fruits beautify Mediterranean gardens.,Middle East,Mediterranean to Subtropical,Shrub,Symbol of fertility in ancient cultures,"Pomegranate (Punica granatum) is a deciduous shrub or small tree native to the Middle East, particularly the region of modern-day Iran, and widely cultivated across Mediterranean and subtropical climates. Typically reaching 12–20 feet in height, the tree is known for its glossy, lance-shaped leaves, which turn a brilliant yellow in autumn, adding seasonal beauty to gardens and landscapes. The leaves are arranged oppositely, smooth, and leathery, adapted to conserve water and optimize photosynthesis in arid conditions.

In spring and early summer, the pomegranate produces striking scarlet-red flowers, which eventually develop into its iconic fruit. The fruits, encased in a tough, leathery rind, contain hundreds of jewel-like seeds, or arils, filled with tangy-sweet juice. Rich in antioxidants, vitamins, and minerals, pomegranates are prized in cuisines worldwide, from fresh juices and desserts to savory dishes and salads. Beyond their culinary value, they have been used in traditional medicine for centuries, believed to support cardiovascular health, reduce inflammation, and strengthen immunity.

The pomegranate tree is well-suited for cultivation in hot, dry regions, thriving in well-drained soils with full sunlight. Its drought tolerance and deep root system make it ideal for sustainable gardening and xeriscaping, while its blossoms attract pollinators such as bees, enhancing biodiversity. Additionally, the tree helps prevent soil erosion, contributing to ecological stability in semi-arid landscapes.

Historically, the pomegranate has carried profound symbolic meaning, representing fertility, prosperity, and eternal life in cultures from ancient Persia and Greece to biblical traditions. Its imagery appears in art, mythology, and religious texts, underscoring its cultural significance. Over 4,000 years of cultivation and trade spread the fruit from Asia to Europe and the Americas, where it remains popular today. Modern breeding focuses on improving fruit size, flavor, and resistance to disease, ensuring its role in sustainable agriculture.

✅ Word Count: 300"